{
  "datasets": [
    {
      "dataset_name": "macro_observation_vintage",
      "dataset_namespace": "lake://certified-input-packs/open_macro_v03/p1",
      "snapshot_id": "macro_observation_vintage_20260630"
    },
    {
      "dataset_name": "eod_prices",
      "dataset_namespace": "lake://certified-input-packs/open_macro_v03/p1",
      "snapshot_id": "eod_prices_20260630"
    }
  ],
  "jobs": [
    {
      "job_name": "certified-input-pack-builder-p1",
      "job_namespace": "investintell-datalake-workers"
    }
  ],
  "runs": [
    {
      "export_id": "open_macro_v03_p1_sources_001",
      "job_name": "certified-input-pack-builder-p1",
      "run_id": "open_macro_v03_certified_input_pack_002_20260630"
    }
  ],
  "schema_version": "v2",
  "sources": [
    {
      "source_commit": "fd5916ccd0011dc49b4e1276fbc20c573911339e",
      "source_repo": "investintell-datalake-workers"
    }
  ]
}
